name, alternative_names, bsc_subfamilies, short_definition, explanation
Access Cost, "[\"Bandwitdh Cost\"]", "[\"Data Valuation Techniques\"]", "The cost (not necessarily the price) incurred for accessing a dataset.", "The cost (not necessarily price) incurred for accessing a dataset based on historical access logs and the cloud provider's pricing (if existing). This metric directly refers to the cost incurred when accessing data, which is influenced by bandwidth, especially in geodistributed data systems where data needs to be transferred over long distances."
Accessibility, "[\"Search\", \"Functionality\", \"Navigation\", \"Link\"]", "[\"Data Valuation Techniques\", \"Data Governance and Compliance\", \"Technology and Infrastructure\"]", "Accessibility in data and information systems refers to how easily users can access, understand, and utilize data factoring in availability, usability, interoperability, inclusivity, security, licensing, and standardized formatting to maximize its value and usability.", "Accessibility, in the context of data and information systems, refers to the ease with which users can access and utilize data. It encompasses several key aspects:\nAvailability: Data should be readily available to authorized users when needed, without unnecessary delays or barriers.\nUsability: The data should be presented in a format that is easy to understand and navigate, allowing users to efficiently find and use the information they need.\nInteroperability: Data should be compatible with various systems and applications, enabling seamless integration and exchange of information across different platforms.\nInclusivity: Accessibility also considers the needs of diverse user groups, including those with disabilities. This means ensuring that data and information systems are designed to be usable by individuals with varying abilities, such as providing alternative formats or assistive technologies.\nSecurity and Permissions: While ensuring accessibility, it is also important to manage access controls and permissions to protect sensitive data from unauthorized access.\nOpen to use / licensing: There is no limit on users to use the data.\nFormat: Follow prestrucutred definitions for the data content strucutre, for example, does the dataset match Berners-Lee's 'linked data principles'?\nOverall, accessibility is crucial for maximizing the value of data, as it ensures that users can effectively leverage the information for decision-making, analysis, and other purposes. Measures how accessible the platform is for users in terms of ease of navigation, search, and data retrieval."
Accuracy, "[]", "[\"Data Quality\"]", "Accuracy is a multifaceted measure of how well data aligns with true or expected values, encompassing elements like precision, relevance, timeliness, completeness, and context to ensure reliability and validity in achieving research objectives.", "Accuracy in the context of scientific analysis is a comprehensive measure of how closely data or results align with the true, intended, or expected values. It encompasses multiple facets that ensure the reliability, applicability, and validity of the information within the specific scientific domain. The accuracy of data or results is not only about correctness but also about their overall suitability for achieving the desired objectives in a given context.\nThe complexity of the relationship between accuracy and the value gained depends on the type of information and the organization. Moreover, unless specified, the basic calculation of value obtained by meeting the required accuracy. As defined by [12] Accuracy is depends on Range, Consistency, Typicality and Moderation Metrics. Nevertheless, different key elements can also be used to explain accuracy:\nPrecision: Refers to the granularity or level of detail in the data. In science, precision ensures that measurements are not only correct but also detailed enough to provide meaningful insights. For example, reporting a temperature as 37.456°C instead of rounding to 37°C can be crucial in laboratory experiments.\nTimeliness: Information must reflect the most current state. In scientific research, outdated data can lead to incorrect conclusions, making the timeliness of updates or recalibrations essential.\nRelevance: Accuracy is context-dependent. Data must be both correct and directly applicable to the research question or hypothesis. For instance, accurate but irrelevant data adds no value to the scientific inquiry.\nCompleteness: Scientific accuracy requires that no critical data points are missing. Incomplete datasets can lead to skewed or biased results, undermining the validity of findings.\nTraceability: The provenance of data ensures it can be verified and validated. For science, traceability means being able to track data back to its source, such as instrumentation or observation records, to confirm its authenticity.\nTolerance and Range: Recognizes that minor inaccuracies or deviations may be acceptable within specified thresholds. Scientific accuracy involves defining these thresholds to minimize the impact on overall validity. Furthermore, in terms of range it specifies limits for acceptance too.\nContext Dependence: Accuracy must meet the specific standards and expectations of the scientific discipline. For example, a minor deviation in physics experiments might be acceptable, whereas in clinical trials, even small inaccuracies can have serious consequences.\nConsistency: Data should be reliable and uniform across various trials or applications. Inconsistencies in repeated experiments can signal issues with data accuracy.\nTypicality: Measures whether the data reflects typical or expected conditions. Atypical data may require additional validation to ensure its accuracy.\nModeration: Ensures data is not skewed or biased toward extremes. Balanced data contributes to overall scientific accuracy by avoiding distortions."
Adaptability, "[\"Versatility\", \"Flexibility\"]", "[\"Operational Efficiency\"]", "Relates to how well a system can adjust to changes in its environment, such as varying network conditions, changing user needs, or different operating contexts.", "Relates to how well a system can adjust to changes in its environment, such as varying network conditions, changing user needs, or different operating contexts. Adaptable systems make scalability more efficient because they can dynamically adjust their resources and behavior to accommodate growth. "
Age, "[\"Data Creation\", \"Time Index\", \"Age of Information\"]", "[\"Data Quality\"]", "Refers to how recent or old the data is.", "Refers to how recent or old the data is. The age of data can impact its relevance and accuracy, especially in fast-moving fields like technology or finance."
Availability, "[\"Retrievability\"]", "[\"Operational Efficiency\"]", "Data availability refers to the reliable, timely, and uninterrupted access to data by authorized users, supported by system robustness, fault tolerance, backups, and redundancy to ensure operational continuity and effective decision-making.", "Data availability refers to the degree to which data is accessible and retrievable when needed, by authorized users or systems. It ensures that the data can be accessed in a timely manner without interruption, and is crucial for maintaining smooth operations, decision-making, and service continuity. As a KPI it could have the following Key Aspects:\nAccessibility: Ensuring that the data is available to authorized users when they need it, whether for operational or analytical purposes. (i.e. binary per dataset) \nReliability (Measure throughout System Robustness): The data should be consistently available without frequent downtime or failures.\nFault tolerance (Measured through System Robustness): Systems storing the data should be resilient to hardware or software failures, ensuring minimal disruption in data access. \nBackup: Implementing regular backups and quick recovery solutions ensures that data is still available after incidents like data corruption or system failures.\nRedundancy: Data availability can be enhanced through redundant systems (e.g., having multiple copies of the data across servers), so if one system fails, another is still operational."
Backup, "[\"System Backup\", \"Recovery Capabilities\", \"Data Redundancy\", \"Reduction\"]", "[\"Operational Efficiency\"]", "A system's ability to securely preserve data and ensure its availability for recovery during disruptions, emphasizing robust mechanisms and minimal data loss.", "A system's ability to securely preserve data and ensure its availability for recovery during disruptions, emphasizing robust mechanisms and minimal data loss. The opposit perspective of backup is Data Redundancy Reduction, that can be a metric when the objective is a scalable services (big IoT services) without considreable repetition, as mentioned in [105]."
Budget, "[\"Costs Planned\", \"IT Plan\", \"Plan\"]", "[\"Data Monetization\"]", "A budget is a financial plan that outlines expected income and expenditures over a specific period.", "A budget is a financial plan that outlines expected income and expenditures over a specific period. It represents an estimate of how much money an individual, business, government, or organization expects to earn (revenue) and how much it plans to spend (expenses) to achieve certain financial or operational goals."
Cache Size, "[]", "[\"Technology and Infrastructure\"]", "Cache size refers to the amount of data (e.g gigabytes) that a cache can store at any given time.", "Cache size refers to the amount of data (measured in units such as kilobytes, megabytes, gigabytes, etc.) that a cache can store at any given time. The cache is a high-speed data storage layer that stores a subset of data, typically temporary, to serve future requests more quickly than retrieving the data from its primary storage or origin location."
CAPEX, "[\"Capital Cost\", \"Hardware Costs\", \"Software/Application Costs\", \"Service Cost\", \"Infrastructure Unit Costs\"]", "[\"Data Monetization\"]", "CAPEX refers to one-time investments in long-term physical and technological assets—like hardware for data capture, storage, and processing—essential for building or upgrading data systems, with costs sometimes offset by asset depreciation or pre-installed software.", "CAPEX refers to the one-time, upfront investments made to acquire, upgrade, or maintain physical assets or infrastructure, independent on the number of quotes needed to cover this expense. These expenses are typically for assets that have a useful life beyond the current accounting period, such as:\n(1) Purchasing new machinery or equipment; (2) Constructing buildings or facilities; (3) Upgrading technology infrastructure (e.g., data centers, servers); (4) Acquiring servers or other long-term assets; (5) Investing in property or land.\nTo be more specific, hardware cost (past of CAPEX) for a data and information system encompasses the following components:\n(1) Data Capturing Hardware: Computers and devices used to collect and input data; (2) Acquisition Systems: Sensors, data acquisition (DAQ) systems, and similar tools for measuring and capturing values; (3) Information Collection Mediums: Devices like PDAs and tablets used for collecting data. (4) Data Storage Hardware: Systems for storing large volumes of data. (5) Data Processing and Analysis Hardware: Computers and servers for processing and analyzing data.\nIf existing hardware is repurposed, the cost should be based on its depreciation during use. If fully depreciated, the cost is effectively zero.\nFurthermore, A significant aspect of Data is the processing, storing, and viewing of it. This requires specialized software to accomplish unlike small data sets. This software can cost and needs to be incorporated into the total costs of the Data system. Although the cost of this software can be significant, other software such as Microsoft Office are often used for data analysis. These types of software are typically pre-installed on the computers bought by organizations and used by employees. Therefore, they normally run at zero cost for the node and can excluded from its costs."
Carbon Usage Effectiveness, "[\"CUE\"]", "[\"Innovation and Growth\"]", "A carbon metric used to measure the environmental impact by assessing the amount of CO2 emissions per unit of IT energy consumed. ", "A carbon metric used to measure the environmental impact by assessing the amount of CO2 emissions per unit of IT energy consumed."
Carbon Emission Factor, "[\"CEF\"]", "[\"Innovation and Growth\"]", "The amount of carbon dioxide (CO2) emissions produced per unit of energy consumed, typically expressed in kilograms of CO2 per kilowatt-hour (kgCO2/kWh).", "Coefficient used to calculate the amount of carbon dioxide (CO2) emissions produced per unit of energy consumed, typically expressed in kilograms of CO2 per kilowatt-hour (kgCO2/kWh). It varies depending on the energy source (e.g., coal, natural gas, renewable energy) and the region's energy mix."
Churn, "[]", "[\"Customer Needs and Satisfaction\", \"Market Penetration\"]", "Churn refers to customer loss, and predicting it involves analyzing data such as demographics, usage patterns, transactions, interactions, sentiment, and external factors to help businesses retain customers proactively.", "The term churn refers to the loss of customers, and predicting churn helps businesses take proactive measures to retain customers before they leave. Data Used for Churn Prediction: \nCustomer Demographics: Age, gender, location, and other personal information that can give insights into churn behaviour.\nUsage Patterns: How often and in what way customers use the service (e.g., call frequency, data usage, purchase frequency).\nTransaction History: Purchase or payment records, subscription renewals, or cancellations.\nInteraction Data: Customer interactions with the company's customer service, support requests, or social media engagement.\nSentiment Analysis: Textual data from customer feedback, complaints, or reviews that can reveal dissatisfaction.\nExternal Data: Market trends, economic factors, or competitor actions that may influence customer churn."
Clarity, "[\"Understandability\", \"Easy to Understand\", \"Lack of Confusion\", \"Unambiguity\", \"Concise\", \"Readability\", \"Interpretability\"]", "[\"Customer Needs and Satisfaction\", \"Market Penetration\"]", "Clarity in data refers to how easily it can be understood and interpreted, emphasizing simplicity, structure, consistency, readability, contextual explanation, appropriate visualization, and completeness to ensure users can draw accurate insights without confusion.", "Clarity in the context of data refers to how easily the data can be understood, interpreted, and used by its intended audience. It involves presenting data in a way that is straightforward, unambiguous, and free from unnecessary complexity. Clear data allows users to quickly grasp its meaning, draw insights, and make decisions without confusion or misinterpretation. The key aspects of data clarity from a KPI perspective are:\nSimplicity and Structure: Data should be presented in a well-organized manner, often through tables, graphs, or summaries that make complex data easier to digest. Example: Using clear, concise headers in a dataset and avoiding overly complex structures.\nConsistency: Consistent terminology, formats, and units of measurement improve clarity. Data should follow the same structure and presentation style across the dataset.\nReadability: Data should be easily readable, with clear labels, appropriate formatting, and a clean layout. Good readability ensures that the user can navigate the data without confusion.\nContext, Metadata, and/or Explanation: Providing context or explanations (e.g., metadata, labels, or definitions) that clarify what the data represents.\nRedundancy/Containment Fraction: Data should be free from unnecessary repetition or irrelevant (Within the same dataset only, since redundancy is important for availability) information that can clutter the understanding. Example: Avoiding the use of the same information in multiple columns or rows when that doesn't add value to an analysis.\nVisualization: Using the right type of visualization (charts, graphs, maps, etc.) can enhance clarity by making patterns, trends, or insights easier to recognize.\nCompleteness: checks if the dataset has all the required fields and values without missing information (measured as a percentage).\nNot all these factors are included in the main taxonomy figure, for simplicity they have been reduced there. Nevertheless, these factors could be considered as a base since several of the main components here can be bound to readability, conciseness, and understandability."
CO2 Savings, "[]", "[\"Innovation and Growth\", \"Operational Efficiency\"]", "CO2 Savings measures the reduction in data center carbon emissions from a baseline, reflecting the impact of energy optimization, renewable integration, and heat recovery strategies like those implemented in the GENiC system.", "The metric CO2 Savings refers to the change in data center CO2 emissions from a given baseline. This metric evaluates the reduction in CO2 emissions achieved by implementing the GENiC system and its integrated management strategies for optimizing energy usage, renewable energy integration, and heat recovery in data centers."
Completeness, "[\"Appropriate Amount of Data\"]", "[\"Data Quality\"]", "Completeness in data refers to the extent to which all necessary and expected information is present in a dataset, ensuring mandatory fields are filled, missing values are minimal, and the data is sufficiently detailed for accurate analysis.", "Completeness in data refers to the extent to which all required data is available and present within a dataset. It measures how much of the expected information is provided, indicating whether or not critical data fields are missing or left blank.\nKey aspects of data completeness include:\nPresence of mandatory fields: All required fields have values.\nProportion of missing data: A low percentage of missing or null values indicates better completeness.\nConsistency with expectations: The dataset should align with the expected structure and content, covering all data points.\nGranularity: The data should provide enough detail to meet the desired level of analysis.\nFor example, in a customer database, completeness would ensure that fields like customer names, addresses, and contact details are filled for every record. A lack of data in important fields would indicate incomplete data."
Regulatory Compliance, "[\"Compliance Cost\"]", "[\"Data Governance and Compliance\"]", "Compliance measures the extent to which data adheres to legal, regulatory, and organizational standards, assessing both the alignment with required rules and the potential financial risks of non-compliance.", "Regulatory Compliance measures whether the data complies with relevant legal and regulatory standards. Estimated financial cost to business of not keeping data for compliance/regulation purposes. It can be defined as a quantitative or qualitative measure that evaluates the extent to which data adheres to the predefined rules, standards, or requirements. Compliance metrics focus on ensuring data consistency, reliability, and alignment with organizational or regulatory frameworks."
Conciseness, "[\"Concise Representation\", \"Simplicity\"]", "[\"Data Quality\"]", "Conciseness in data refers to presenting essential information clearly and efficiently, minimizing redundancy and irrelevant details while maintaining clarity, relevance, and semantic consistency for effective communication and understanding.", "Conciseness refers to the principle of presenting data or information in a way that is both brief and clear, without unnecessary detail or redundancy. The goal is to convey the essential meaning or facts in the most straightforward and efficient manner possible, while still being complete and accurate. Key Characteristics of Concise Representation could include (To chose from the tyep of system considerations):\nBrevity/Compression: The information is presented using the fewest words, symbols, or data points necessary to communicate the intended meaning. It also Reflects how much data can be compacted without losing critical information. \nClarity: The content is clear and easy to follow, even when reduced to its essential elements. \nEfficiency/Signal-to-noise Ratio: It avoids redundancy, long-winded explanations, or superfluous data that could confuse or overwhelm the user. Also, can be considered as the proportion of useful, relevant information (signal) to irrelevant or extraneous data (noise). \nRedundancy: Measures the repetition of identical or similar data within a system or dataset.\nRelevance: Only the most relevant information is included, eliminating any extraneous data that doesn't add value to the understanding of the content.\nSemantic Consistency: Measures alignment and consistency in the terminology and format used across the dataset.\nDuplicate Elimination: a measure for the process of identifying and removing identical or near-identical records."
Confidence, "[]", "[\"Operational Efficiency\", \"Data Quality\"]", "TODO", "The confidence metric measures how strongly a dependency (MD or MFD TODO: unclear what these are.) holds in the dataset."
Consistency, "[\"Heterogeneity\", \"Veracity\"]", "[\"Data Quality\"]", "Consistency in data refers to the uniformity, reliability, and rule-conformance of data across systems, ensuring accuracy, coherence, and integrity by validating against predefined rules and maintaining synchronization across datasets.", "Consistency refers to how well data values conform to predefined rules, such as association rules in the context of relational databases. The metric for consistency, as defined by Alpar and Winkelsträter [118], evaluates the consistency of a tuple t based on whether it fulfills or violates certain rules r from a set R of association rules. Consistency, in the context of data management and information systems, refers to the uniformity and reliability of data across different datasets, systems, and applications. It ensures that data remains accurate, coherent, and free from contradictions, which is essential for maintaining data integrity and trustworthiness. Key aspects of consistency (for a KPI consideration) include: Data Integrity, Uniformity, Synchronization, Rules validation, Error Prevention, and Governance."
Containment Fraction, "[]", "[\"Operational Efficiency\", \"Data Quality\"]", "Measures the extent to which one dataset is contained within another.", "Measures the extent to which one dataset is contained within another. This metric helps identify redundancy and optimize storage usage. A limit in containment fraction has to exist since availability depends on duplication, for security, of the same information."
Cooling Effectiveness Rate, "[\"CER\", \"Energy Effectiveness of Cooling\"]", "[\"Operational Efficiency\"]", "Focuses on the effectiveness of cooling systems in the data center.", "Focuses on the effectiveness of cooling systems in the data center. There are direct linkage to other metrics related to cooling effectivenes, such as ”Energy Effectiveness of Cooling Mode in a Season”. Assesses how effectively the cooling system operates in different seasons, which can influence operational costs and carbon emissions."
Cost of Degradation, "[\"CoD\"]", "[\"Data Quality\"]", "Cost of Degradation measures the reduction in data quality caused by transformations, particularly in privacy-preserving contexts. It helps quantify how much value the data has lost through necessary adjustments for privacy.", "Cost of Degradation measures the reduction in data quality caused by transformations, particularly in privacy-preserving contexts. It helps quantify how much value the data has lost through necessary adjustments for privacy."
Data Acquisition Cost, "[\"DAC\"]", "[\"Data Monetization\"]", "Data Acquisition Cost (DAC) represents the proportion of data or local models that a Data Acquirer must obtain from Data Providers during each federated learning training epoch to build an accurate global model, serving as a non-monetary measure of acquisition effort.", "Data Acquisition Cost (DAC) refers to the cost, typically measured as a percentage, associated with acquiring local models from the Data Providers (DPs) during each training epoch in a federated learning setup. The DAC represents the fraction of data or local models the Data Acquirer (DA) needs to purchase or gather from the DPs to train an accurate and effective global model. In the traditional sense, DAC is not directly a monetary cost; rather, it represents the fraction of available data or local models that must be procured. All other costs are encapsulated within the metric Cost (e.g. Purchase Cost, OPEX, etc.)."
Data Centre Adaptation, "[\"Data Centre Energy Profile Change\"]", "[\"Operational Efficiency\"]", "The Data Centre Adaptation (DCA) metric measures the change in a data center's energy profile from a predefined baseline, reflecting its adaptability, energy efficiency, and integration of renewable energy within the GENiC framework.", "The Data Centre Energy Profile Change is referred to as DCA (Data Centre Adaptation) in the context of energy metrics outlined in the GENiC framework from the manuscript. It captures the change in the data center's energy profile from a predefined baseline. This metric is part of a broader set of evaluation measures used to assess energy efficiency, sustainability, and the ability to adapt to renewable energy integration [44]."
