Data Ingestion Capabilities, "[\"Data Collection and Management Capabilities\", \"Data Analysis\", \"Data Mining\", \"Data Sources\"]", "[\"Technology and Infrastructure\"]", "Data Ingestion Capabilities refer to a system's ability to efficiently collect, process, and store large volumes of data from diverse sources in real time, ensuring high throughput, low latency, scalability, and data integrity, especially in high-velocity environments like IoT.", "Data Ingestion Capabilities refer to the ability of a system to effectively and efficiently handle the process of acquiring, collecting, and storing data from various sources. This capability is critical for managing large-scale, high-velocity data flows, especially in contexts like IoT applications, where data is generated continuously by sensors and devices. Effective data ingestion ensures the system's ability to (key components): Handle High Throughput (Throughput), Accommodate Delays (Latency, and handling delayed data), Ensure Scalability (e.g. Scalability is evaluated by testing throughput and latency as the number of devices, sensors, or data points increases), Maintain Data Integrity. In practice, this involves technologies like time-series databases, message queues (e.g., Kafka), and specialized data formats like TsFile for compression and organization."
Data Price, "[\"Data Value\", \"Price Function\", \"Payoff Reimbursement\", \"Financial Value\", \"Price of Information\"]", "[\"Data Monetization\"]", "Data price refers to the monetary value assigned to data, determined through models or market mechanisms, incorporating factors like cost, contribution rewards, compensation, and volume-based pricing using approaches such as entropy valuation, utility models, or dynamic pricing.", "Data price is the financial value assigned to data, determined through models or market mechanisms. It encompasses concepts like monetary cost, price functions, payoff (reward for contributions), reimbursement (compensation for costs), and volume-based metrics (e.g., price per MB). Methodologies include entropy-based valuation, utility models, and dynamic pricing, tailored to specific contexts such as privacy, real-time trading, or structured markets."
Oversight, "[\"Audit\"]", "[\"Data Governance and Compliance\"]", "Governance Audit Capability assesses an organization's ability to monitor, validate, and ensure adherence to governance standards through mechanisms like periodic audits and compliance checks.", "Assesses the organization's capability to monitor and validate compliance with governance standards, processes, and policies. It includes mechanisms for periodic audits to ensure data integrity and proper governance implementation."
Data Principles and Practices, "[\"Data-Standard Driven\", \"Standardization\"]", "[\"Data Governance and Compliance\"]", "Data Quality Compliance measures the extent to which an organization adheres to defined data standards and principles, reflecting its commitment to ensuring data consistency, reliability, and alignment with organizational goals through quantifiable metrics.", "This metric measures the degree to which an organization adheres to defined data standards and principles to maintain data quality and governance. It emphasizes commitment to data quality policies, ensuring data is consistent, reliable, and aligned with organizational objectives [97], [57], [54].\nKey components:\nCommitment to Data Quality: Demonstrates adherence to predefined data standards and a commitment to maintaining high-quality data across systems and processes [57], [54].\nQuantifiable Standards: Measures compliance through clear metrics, such as achieving specific scores or thresholds in data quality assessments [57], [54]."
Data Similarity, "[\"Euclidian Distance\", \"Projection Similarity\", \"Similarity Score\", \"Cosine Similarity\", \"Average Distance\", \"Kolmogorov-Smirnov (KS)\", \"Mann-Whitney (MW)\", \"Mood s Median (MD)\", \"Levene (LE)\"]", "[\"Data Quality\"]", "Data Similarity refers to the numerical measurement of how closely related two data points or datasets are, typically using distance or similarity metrics like Euclidean Distance or Cosine Similarity, and is distinct from syntactic similarity due to its focus on numerical attributes.", "These metrics are a measure to compute the distance between two points within a given space, commonly applied to numerical attributes. Such metrics are distinguished from syntactic similarity due to their numerical basis. Projection Similarity, for instance, calculates the similarity of datasets based on feature dimensions from other datasets."
Data Type, "[]", "[\"Data Valuation Techniques\"]", "Data can be classified into categories (A–D) based on its intended use, ranging from time-sensitive operational data to long-term legal, decision-making, or research-related data, each with distinct characteristics in terms of frequency, lifespan, value realization, and sensitivity.", "Depending on the possible use of the data, it can be classified. In [117], is classified or scored on the decision-based valuation method. (A, B, C, and D) A is operational data (i.e. It has a predetermined frequency; It has a short usable life span proportional to its frequency; It is very time sensitive and its value depreciates rapidly after its timeframe; and Its value is quickly realized through its use.) B is a One Time Decision Data (i.e. It does not have a predetermined frequency; It has a usable life span of the length of the decision; It is often not very time sensitive; There is a high emphasis on accuracy; It has a high value but often a high cost as well; and Its value takes a long period of time to be realized.) Type C is Legal and Safety Data (i.e. It has almost no value to the organization; The true value of the data can only be estimated on the probability of its need; It often has to be stored for a minimum of five years if not longer; The organization is legally required to collect and store it; There can often be a legally required frequency; and It can have an indefinite life span.) and D is Research and Innovation data (i.e. It has a very low chance of providing future incomes; It is difficult to predict whether it will provide value; It has a large value range; and It has a long life span). TODO: This explanation is horrendous, need to find a better way to make this clear."
Data Value, "[\"DV\", \"Data Criticallity\", \"Value of Information\", \"Fixed Record Value\", \"IP Value\", \"Intrinsic Record Value\"]", "[\"Data Valuation Techniques\"]", "Data value refers to the level of usefulness or relevance data holds for a specific consumer or context, varying with application needs, and is often assessed through factors like cost, lifecycle, and criticality to business operations and decision-making.", "Level of usefulness or relevance a data object has for a particular data consumer, which can vary depending on the consumer's application context and specific needs. This means that Data Value is not static; it changes based on how well the data fits the purpose it's being used for, even if the Data Quality (DQ) of the data remains constant. For distribucion services it can measures the value of a decision node in the Decision-Based Valuation (DBV) framework, taking into account factors like cost and lifecycle. Also, can refer to Data Criticality: refers to the importance of data for both consumers and the company. It evaluates how essential certain data is in the context of business operations and decision-making. The measure of data criticality assesses the impact that data has on the organization and its customers, particularly regarding its role in supporting business processes, revenue generation, and service delivery."
Data Value Ratio, "[\"VR\"]", "[\"Data Valuation Techniques\"]", "The Data Value Ratio (VR) represents the proportion of a decision node's value attributed to a specific data source.", "The Data Value Ratio (VR) represents the proportion of a decision node's value attributed to a specific data source."
Demand, "[\"Score\", \"Number of Data Consumers\"]", "[\"Data Monetization\"]", "Data demand refers to the desirability or market need for specific data types, typically measured through buyer willingness-to-pay scores or strategic value within a broader data value chain, often informing pricing and data management strategies.", "The demand or score for data is defined differently depending on the system under consideration and thus, the strategy to be implemented. For example, in the [TODO: Broken reference], demand for data is conceptualized as buyers' willingness to pay for specific types of information. This demand is measured using a scoring mechanism where buyers rate the desirability of different categories of data. The resulting score reflects the demand for that data type in the market. Combined with the data's utility (a measure of how much the data quality degrades after privacy-preserving obfuscation), these scores are used to establish a pricing model for information. In [TODO: Broken reference], demand or value of data is analyzed as part of a broader data value chain management. Here, demand is less about individual buyers and more about the data's role in enabling strategic decisions, cost efficiency, and economic outcomes."
Detail, "[]", "[\"Data Quality\"]", "Data Detail refers to the level of specificity and descriptive richness in a dataset, typically measured through granularity, number of descriptive attributes, and the precision with which data points are captured.", "There is no clear specification of Detail for its estimation in the literature. Nevertheless, purely technical accuracy consideration could imply how finely data is broken down or how much descriptive information is captured in each data point. Then Key Aspects of Data incorporate are:\nGranularity: The extent to which data is broken down into smaller, specific components. High granularity means more detailed data.\nDescriptive Attributes: The number of attributes or fields that describe an entity or event. More detailed datasets have a larger number of attributes that provide rich, descriptive context.\nPrecision: How exact the data is. For numerical data, this might refer to how many decimal points are included, for temporal data, the description of timestamps, while for categorical data, it refers to the specificity of categories."
Differential Privacy, "[]", "[\"Data Governance and Compliance\"]", "Same as Inferential Privacy, but in the opposite direction (Check for Inferential Privacy).", "Same as Inferential Privacy, but in the opposite direction (Check for Inferential Privacy). Also as defined in [TODO: Broken reference], a metric used to gauge the level of privacy preserved in data when shared or sold in marketplaces. Also, the (ϵ, δ)-differential privacy is a widely adopted concept to quantify the privacy loss in private machine learning (ML) algorithms."
Discoverability, "['Effectiveness (Platform), \"Platform Performance\"]", "[\"Innovation and Growth\"]", "Discoverability measures how easily a dataset or platform allows users to find relevant information, focusing on the effectiveness of search functionality and the dataset’s ability to meet users’ informational needs.", "As defined in [34], this is a metric that describes the ability of a dataset to show the content of information and be able to search or discover datasets. For a platform, measures the platform's ability to meet the user's information needs accurately. This KPI evaluates how effective the search functionality is in returning relevant datasets based on user input."
Space Cost, "[\"Disk Occupation\"]", "[\"Data Valuation Techniques\"]", "Space Cost refers to the amount of storage required to retain data, influenced by file format and storage mechanisms, and can be tied to the ongoing costs of maintaining that data.", "Space Cost refers to the amount of storage space required to store data, which can vary depending on the file format and storage mechanisms used. The cost can be linked later on the cost associated to maintain such information."
Downloads, "[\"Download Frequency\"]", "[\"Customer Needs and Satisfaction\", \"Market Penetration\"]", "The number of times users have dowloaded a dataset.", "The number of times users have dowloaded a dataset."
Economic Efficiency, "[\"Data Business Characteric Index\", \"Business Criticality\"]", "[\"Data Monetization\"]", "Economic Efficiency / Business Criticality is an index that evaluates the importance of data to business operations by weighting its relevance to key processes, while also ensuring that the application of data quality measures yields benefits that justify their associated costs.", "This index represents how critical the data is for business processes. It is determined by assigning weights to data based on its relevance to various operational requirements, with higher-weighted data indicating greater business importance. Economic efficiency can also refers to the cost-benefit balance when applying data quality metrics (i.e. another operation). The requirement of economic efficiency, labeled as \"Requirement\", ensures that the use of data quality metrics must justify the costs involved, meaning the benefits obtained from improved data quality should outweigh the costs of measuring and improving that quality."
Encryption Time, "[\"ET\", \"Decryption Time\", \"DT\"]", "[\"Operational Efficiency\"]", "Measures the time taken to convert plaintext data into an encrypted format using encryption algorithms.", "This metric measures the time taken to convert plaintext data into an encrypted format using encryption algorithms. It's important in cloud and data security to understand how quickly data can be secured before transmission or storage."
Energy Efficiency, "[\"Power to Performance Effectiveness\", \"PPE\", \"Power Usage Effectiveness\", \"PUE\", \"Data Centre Infrastructure Efficiency\", \"DCiE\", \"Data Centre Performance per Energy\", \"DPPE\", \"Data Centre Energy Productivity\", \"DCEP\", \"Communication Network Energy Efficiency\", \"CNEE\", \"Network Power Usage Effectiveness\", \"NPUE\", \"Energy Proportionality Coefficient\", \"EPC\"]", "[\"Operational Efficiency\"]", "Energy Efficiency Metrics for Data Centers assess how effectively energy is utilized relative to performance outputs, combining ratios like PUE, DCiE, DCEP, PPE, CNEE, NPUE, and EPC to provide a comprehensive view of how well IT equipment, networks, and infrastructure convert power into useful computational work.", "Measures how efficiently the system handles workloads concerning energy consumption. This ratio is a key metric for operational efficiency. The PUE Measures the energy efficiency of a data center by comparing the total facility energy to the energy used by IT equipment. The DCiE is the inverse of PUE, used to measure the ratio of IT equipment energy to the total facility energy. Developed by Japan's Green IT Promotion Council, the Data Cetnre Perfromance per Energy metric combines four sub-metrics: Green Energy Consumption (GEC), Power Usage Effectiveness (PUE), IT Equipment Energy Efficiency (ITEE), and IT Equipment Utilization (ITEU). It provides a holistic view of the energy efficiency of data centers, factoring in both facility and IT equipment performance. Similarly, Power to Performance Effectiveness (PPE) is a metric that evaluates the efficiency of energy consumption in relation to the performance output of IT equipment within a data center. Specifically, PPE measures how much power is consumed to achieve a certain level of performance. DCEP: This metric measures the productivity of a data center relative to the energy it consumes. It evaluates how much useful work (e.g., computational tasks, data processing) is accomplished per unit of energy consumed. Communication Network Energy Efficiency (CNEE) is a metric that evaluates the energy efficiency of a data center's communication network. It measures the amount of energy required to deliver a unit of data (usually a bit or byte) across the network within a data center. NPUE: This is a more specific metric that focuses on the energy consumed by the networking components of the data center. EPC: evaluates how well the energy consumption of individual devices or systems (such as servers, networking devices, or storage systems) scales with their workload. In an ideal scenario, a system with high EPC would use energy proportionally to its workload, consuming minimal energy when under low or no load."
Power Usage Efficiency, "[\"Total Energy Usage Effectiveness\", \"TUE\", \"Data Center Efficiency\", \"DCE\"]", "[\"Operational Efficiency\"]", "TODO", "TODO: WHAT IS THE DIFFERENCE WITH THE PREVIOUS ONE?!"
Total Equipment Utilization, "[\"TEU\"]", "[\"Operational Efficiency\"]", "TODO", "TODO: needs more explation. Encompasses the overall facility's resource usage. It includes cooling, power distribution, and other supporting infrastructure components. "
IT Equipment Utilization, "[\"ITEU\"]", "[\"Operational Efficiency\"]", "TODO", "The ITEU metric focuses on the ratio of actual energy consumption to the rated energy consumption of IT equipment, providing insight into the energy utilization efficiency of the IT infrastructure. TODO: maybe more detail?"
IT Equipment Energy Efficiency, "[\"ITEE\"]", "[\"Operational Efficiency\"]", "TODO", "TODO: missing explanation here, same as the previous one."
Data Center Performance Per Energy, "[\"DPPE\"]", "[\"Operational Efficiency\"]", "TODO", "TODO: Again, seems to be already included in Energy Efficiency."
Energy Reuse Fraction, "[\"ERF\", \"Energy Reuse Effectiveness\", \"ERE\"]", "[\"Operational Efficiency\"]", "The ERF, defined in ISO/IEC 30134-6 / EN 50600-4-6, determines the share of the total energy consumption that is reused.", "The ERF, defined in ISO/IEC 30134-6 / EN 50600-4-6, determines the share of the total energy consumption that is reused."
Power Usage Effectiveness, "[\"PUE\"]", "[\"Operational Efficiency\"]", "TODO", "TODO: same description as CUE"
Power Density Efficiency, "[\"PDE\"]", "[\"Operational Efficiency\"]", "Power Density Efficiency (PDE) is a refinement of traditional PUE metrics that evaluates the energy efficiency improvements resulting from physical changes within IT racks, offering insights into both IT equipment and cooling system performance.", "A variation of the PUE metric, called power density efficiency (PDE), that can provide insight into the improvements to both the IT equipment and the supporting cooling system. The proposed metric enables evaluation of the impact of physical changes inside the racks on energy efficiency, which is not possible using the common metrics above TODO: Above what? Provide example instead."
Water Usage Effectiveness, "[\"WUE\"]", "[\"Operational Efficiency\"]", "Assesses the water efficiency of data centers. It measures the amount of water a data center uses in relation to the energy consumed by its IT equipment.", "Assesses the water efficiency of data centers. It measures the amount of water a data center uses in relation to the energy consumed by its IT equipment."
Energy ExpenseS, "[\"EES\"]", "[\"Operational Efficiency\"]", "Quantifies how the Energy ExpenseS have been altered (i.e. increased or decreased) compared to a baseline scenario after the equipment is upgraded or the introduction of flexibility mechanisms.", "Quantifies how the Energy ExpenseS have been altered (i.e. increased or decreased) compared to a baseline scenario after the equipment is upgraded or the introduction of flexibility mechanisms."
IT Power Usage Effectiveness, "[\"ITUE\"]", "[\"Operational Efficiency\"]", "The ITUE is a PUE-type metric for the IT equipment rather than for the data center.", "The ITUE is a PUE-type metric for the IT equipment rather than for the data center."
TUE, "[\"TODO: replace with the real name\"]", "[\"Operational Efficiency\"]", "Total Energy of the data centre divided by the total energy into the computational components (as defined in ITUE).", "Total Energy of the data centre divided by the total energy into the computational components (as defined in ITUE). TODO: needs a better explanation."
Data Center Productivity, "[\"DCP\"]", "[\"Operational Efficiency\"]", "Data Center Productivity (DCP) is a metric that assesses how effectively a data center transforms consumed energy into meaningful computational output, focusing on performance per energy used rather than just energy distribution.", "Metric that evaluates how effectively a data center converts its consumed energy into useful computational work. Unlike efficiency metrics like PUE, which focus on energy distribution, DCP emphasizes the actual output or performance of a data center in relation to its energy consumption in an area or general components."
Compute Power Efficiency, "[\"CPE\"]", "[\"Operational Efficiency\"]", "Metric that assesses the efficiency of IT equipment in a data center by measuring how much of the total power consumption is effectively used for computation. ", "Metric that assesses the efficiency of IT equipment in a data center by measuring how much of the total power consumption is effectively used for computation."
Green Energy Coefficient, "[\"GEC\"]", "[\"Operational Efficiency\"]", "Metric that quantifies the proportion of energy used in a data center that comes from renewable energy sources. It is used to assess the sustainability and environmental impact of data center operations.", "Metric that quantifies the proportion of energy used in a data center that comes from renewable energy sources. It is used to assess the sustainability and environmental impact of data center operations."
Performance per Watt, "[\"PpW\"]", "[\"Operational Efficiency\"]", "The PpW metric measures the actual energy efficiency of every device in the data center and how it is used.", "The PpW metric measures the actual energy efficiency of every device in the data center and how it is used."
"Space, Wattage, and Performance", "[\"SWaP\"]", "[\"Operational Efficiency\"]", "Metric used to evaluate the efficiency of a system by considering its performance output relative to the space and power it consumes.", "Metric used to evaluate the efficiency of a system by considering its performance output relative to the space and power it consumes."
Data Center Energy Productivity, "[\"DCeP\"]", "[\"Operational Efficiency\"]", "Data Center energy Productivity (DCeP) quantifies the amount of useful work produced by a data center (or individual IT equipment) relative to the energy it consumes, treating the data center as a black box where energy input is measured against computational output.", "The DCeP essentially defines the datacenter as a blackbox — power goes into the box, heat comes out, data goes into and out of the black box, and a net amount of usefulwork is done by the black box. In other words, quantifies useful work compared to the energy it requires. It can be calculated for an individual IT device or a cluster of computing equipment."
Data Center Performance Efficiency, "[\"DCPE\"]", "[\"Operational Efficiency\"]", "Metric used to evaluate how effectively a data center utilizes energy to perform useful work.", "Metric used to evaluate how effectively a data center utilizes energy to perform useful work."
AEUF, "[\"TODO: Add the actual name\"]", "[\"Operational Efficiency\"]", "Metric used to assess how effectively a data center employs its airside economizer system for 'free' cooling.", "Metric used to assess how effectively a data center employs its airside economizer system for 'free' cooling."
Data Center Lighting Density, "[\"DCLD\", \"Lighting Power Density\", \"LPD\"]", "[\"Operational Efficiency\"]", "Measures the electrical power used for lighting per unit area within a data center, typically expressed in watts per square foot (W/ft²) or watts per square meter (W/m²). This metric helps assess the energy efficiency of the lighting system in the facility.", "Measures the electrical power used for lighting per unit area within a data center, typically expressed in watts per square foot (W/ft²) or watts per square meter (W/m²). This metric helps assess the energy efficiency of the lighting system in the facility."
Corporate Average Data Center Efficiency, "[\"CADE\"]", "[\"Operational Efficiency\"]", "Corporate Average Data Efficiency (CADE) is a metric that assesses a corporation's overall data center energy performance by integrating both infrastructure efficiency and IT asset utilization, enabling comparisons across multiple data centers.", "CADE is designed to provide a comprehensive assessment of a corporation's data center energy performance by considering both infrastructure efficiency and IT asset utilization. CADE allows the calculation and measurement of a data center's energy consumption so that it can be compared to the other data centers."
Airflow Efficiency, "[\"AFE\"]", "[\"Operational Efficiency\"]", "Airflow Efficiency measures how effectively a data center's cooling system delivers cool air to IT equipment and removes hot air, aiming to minimize air mixing and optimize energy-efficient cooling performance.", "Airflow Efficiency in the context of data centres refers to the effectiveness with which cool air is delivered to IT equipment and hot air is removed, minimizing mixing and optimizing cooling performance. High airflow efficiency means that the cooling system is well-aligned with the airflow paths, reducing energy use and ensuring reliable equipment operation."
